{
  "$schema": "./item-components.schema.json",
  "schemaVersion": 1,
  "catalogVersion": 2,
  "kind": "TECHNOLOGY",
  "entries": [
    {
      "id": "tech_termico_conversor",
      "name": "Conversor Térmico",
      "rarity": "RARE",
      "category": "OFFENSIVE",
      "origin": "Oficina Industrial",
      "characterCreationVisible": true,
      "compatibleItemTypes": [
        "Arma"
      ],
      "compatibleBaseGroups": [],
      "compatibleBaseIds": [],
      "creationCost": 5,
      "price": 250,
      "load": 0,
      "durability": 6,
      "region": "",
      "pg": 0,
      "pl": 0,
      "agilityLimit": null,
      "maxCharges": 3,
      "recharge": "Recupera 1 carga com uma Ação; carga total após 8 horas",
      "activation": "ACTION",
      "installationKnowledge": "Engenharia ou Ofício apropriado",
      "installationDifficulty": "Definida pela combinação entre aprimoramento e item",
      "removalDifficulty": "Definida pela combinação entre aprimoramento e item",
      "failureEnhancementDamage": 2,
      "failureItemDamage": 1,
      "effect": {
        "type": "MAGIC_DAMAGE",
        "value": 1,
        "target": "damage",
        "condition": "WIELDED",
        "description": "+1 de dano mágico enquanto houver carga."
      }
    },
    {
      "id": "tech_termico_barreira",
      "name": "Barreira Térmico",
      "rarity": "RARE",
      "category": "DEFENSIVE",
      "origin": "Oficina Industrial",
      "characterCreationVisible": true,
      "compatibleItemTypes": [
        "Armadura",
        "Escudo",
        "Acessório"
      ],
      "compatibleBaseGroups": [],
      "compatibleBaseIds": [],
      "creationCost": 5,
      "price": 250,
      "load": 0,
      "durability": 6,
      "region": "",
      "pg": 0,
      "pl": 0,
      "agilityLimit": null,
      "maxCharges": 3,
      "recharge": "Recupera 1 carga com uma Ação; carga total após 8 horas",
      "activation": "ACTION",
      "installationKnowledge": "Engenharia ou Ofício apropriado",
      "installationDifficulty": "Definida pela combinação entre aprimoramento e item",
      "removalDifficulty": "Definida pela combinação entre aprimoramento e item",
      "failureEnhancementDamage": 2,
      "failureItemDamage": 1,
      "effect": {
        "type": "PG",
        "value": 1,
        "target": "protection",
        "condition": "EQUIPPED",
        "description": "+1 PG enquanto houver carga."
      }
    },
    {
      "id": "tech_termico_atuador",
      "name": "Atuador Térmico",
      "rarity": "RARE",
      "category": "AUTOMATION",
      "origin": "Oficina Industrial",
      "characterCreationVisible": true,
      "compatibleItemTypes": [
        "Arma"
      ],
      "compatibleBaseGroups": [],
      "compatibleBaseIds": [],
      "creationCost": 5,
      "price": 250,
      "load": 0,
      "durability": 6,
      "region": "",
      "pg": 0,
      "pl": 0,
      "agilityLimit": null,
      "maxCharges": 3,
      "recharge": "Recupera 1 carga com uma Ação; carga total após 8 horas",
      "activation": "ACTION",
      "installationKnowledge": "Engenharia ou Ofício apropriado",
      "installationDifficulty": "Definida pela combinação entre aprimoramento e item",
      "removalDifficulty": "Definida pela combinação entre aprimoramento e item",
      "failureEnhancementDamage": 2,
      "failureItemDamage": 1,
      "effect": {
        "type": "ATTACK",
        "value": 1,
        "target": "attack",
        "condition": "WIELDED",
        "description": "+1 em Ataque enquanto houver carga."
      }
    },
    {
      "id": "tech_termico_reserva",
      "name": "Reserva Térmico",
      "rarity": "RARE",
      "category": "STORAGE",
      "origin": "Oficina Industrial",
      "characterCreationVisible": true,
      "compatibleItemTypes": [
        "Arma",
        "Armadura",
        "Acessório",
        "Escudo"
      ],
      "compatibleBaseGroups": [],
      "compatibleBaseIds": [],
      "creationCost": 5,
      "price": 250,
      "load": 0,
      "durability": 6,
      "region": "",
      "pg": 0,
      "pl": 0,
      "agilityLimit": null,
      "maxCharges": 3,
      "recharge": "Recupera 1 carga com uma Ação; carga total após 8 horas",
      "activation": "ACTION",
      "installationKnowledge": "Engenharia ou Ofício apropriado",
      "installationDifficulty": "Definida pela combinação entre aprimoramento e item",
      "removalDifficulty": "Definida pela combinação entre aprimoramento e item",
      "failureEnhancementDamage": 2,
      "failureItemDamage": 1,
      "effect": {
        "type": "RULE",
        "value": 0,
        "target": "storage",
        "condition": "WIELDED",
        "description": "Com uma Ação, recupera uma carga de outro mecanismo instalado."
      }
    },
    {
      "id": "tech_termico_nucleo",
      "name": "Núcleo Térmico",
      "rarity": "ANCESTRAL",
      "category": "POWER",
      "origin": "Oficina Industrial",
      "characterCreationVisible": false,
      "compatibleItemTypes": [
        "Arma",
        "Armadura",
        "Acessório",
        "Escudo"
      ],
      "compatibleBaseGroups": [],
      "compatibleBaseIds": [],
      "creationCost": 8,
      "price": 600,
      "load": 0,
      "durability": 8,
      "region": "",
      "pg": 0,
      "pl": 0,
      "agilityLimit": null,
      "maxCharges": 6,
      "recharge": "Recupera 1 carga com uma Ação; carga total após 8 horas",
      "activation": "ACTION",
      "installationKnowledge": "Engenharia ou Ofício apropriado",
      "installationDifficulty": "Definida pela combinação entre aprimoramento e item",
      "removalDifficulty": "Definida pela combinação entre aprimoramento e item",
      "failureEnhancementDamage": 2,
      "failureItemDamage": 1,
      "effect": {
        "type": "RULE",
        "value": 0,
        "target": "power",
        "condition": "WIELDED",
        "description": "Com uma Ação, ativa o efeito singular do núcleo."
      }
    },
    {
      "id": "tech_tesla_conversor",
      "name": "Conversor Tesla",
      "rarity": "RARE",
      "category": "OFFENSIVE",
      "origin": "Laboratório de Bobinas",
      "characterCreationVisible": true,
      "compatibleItemTypes": [
        "Arma"
      ],
      "compatibleBaseGroups": [],
      "compatibleBaseIds": [],
      "creationCost": 5,
      "price": 250,
      "load": 0,
      "durability": 6,
      "region": "",
      "pg": 0,
      "pl": 0,
      "agilityLimit": null,
      "maxCharges": 3,
      "recharge": "Recupera 1 carga com uma Ação; carga total após 8 horas",
      "activation": "ACTION",
      "installationKnowledge": "Engenharia ou Ofício apropriado",
      "installationDifficulty": "Definida pela combinação entre aprimoramento e item",
      "removalDifficulty": "Definida pela combinação entre aprimoramento e item",
      "failureEnhancementDamage": 2,
      "failureItemDamage": 1,
      "effect": {
        "type": "MAGIC_DAMAGE",
        "value": 1,
        "target": "damage",
        "condition": "WIELDED",
        "description": "+1 de dano mágico enquanto houver carga."
      }
    },
    {
      "id": "tech_tesla_barreira",
      "name": "Barreira Tesla",
      "rarity": "RARE",
      "category": "DEFENSIVE",
      "origin": "Laboratório de Bobinas",
      "characterCreationVisible": true,
      "compatibleItemTypes": [
        "Armadura",
        "Escudo",
        "Acessório"
      ],
      "compatibleBaseGroups": [],
      "compatibleBaseIds": [],
      "creationCost": 5,
      "price": 250,
      "load": 0,
      "durability": 6,
      "region": "",
      "pg": 0,
      "pl": 0,
      "agilityLimit": null,
      "maxCharges": 3,
      "recharge": "Recupera 1 carga com uma Ação; carga total após 8 horas",
      "activation": "ACTION",
      "installationKnowledge": "Engenharia ou Ofício apropriado",
      "installationDifficulty": "Definida pela combinação entre aprimoramento e item",
      "removalDifficulty": "Definida pela combinação entre aprimoramento e item",
      "failureEnhancementDamage": 2,
      "failureItemDamage": 1,
      "effect": {
        "type": "PG",
        "value": 1,
        "target": "protection",
        "condition": "EQUIPPED",
        "description": "+1 PG enquanto houver carga."
      }
    },
    {
      "id": "tech_tesla_atuador",
      "name": "Atuador Tesla",
      "rarity": "RARE",
      "category": "AUTOMATION",
      "origin": "Laboratório de Bobinas",
      "characterCreationVisible": true,
      "compatibleItemTypes": [
        "Arma"
      ],
      "compatibleBaseGroups": [],
      "compatibleBaseIds": [],
      "creationCost": 5,
      "price": 250,
      "load": 0,
      "durability": 6,
      "region": "",
      "pg": 0,
      "pl": 0,
      "agilityLimit": null,
      "maxCharges": 3,
      "recharge": "Recupera 1 carga com uma Ação; carga total após 8 horas",
      "activation": "ACTION",
      "installationKnowledge": "Engenharia ou Ofício apropriado",
      "installationDifficulty": "Definida pela combinação entre aprimoramento e item",
      "removalDifficulty": "Definida pela combinação entre aprimoramento e item",
      "failureEnhancementDamage": 2,
      "failureItemDamage": 1,
      "effect": {
        "type": "ATTACK",
        "value": 1,
        "target": "attack",
        "condition": "WIELDED",
        "description": "+1 em Ataque enquanto houver carga."
      }
    },
    {
      "id": "tech_tesla_reserva",
      "name": "Reserva Tesla",
      "rarity": "RARE",
      "category": "STORAGE",
      "origin": "Laboratório de Bobinas",
      "characterCreationVisible": true,
      "compatibleItemTypes": [
        "Arma",
        "Armadura",
        "Acessório",
        "Escudo"
      ],
      "compatibleBaseGroups": [],
      "compatibleBaseIds": [],
      "creationCost": 5,
      "price": 250,
      "load": 0,
      "durability": 6,
      "region": "",
      "pg": 0,
      "pl": 0,
      "agilityLimit": null,
      "maxCharges": 3,